{
  "schemaVersion": "1.0.0",
  "appVersion": "1.0.0",
  "idioma": "es-CU",
  "onboarding": {
    "pasos": [
      {"id": "bienvenida", "titulo": "Bienvenido a FichaCosto", "cuerpo": "Con esta aplicación puede organizar los gastos de su negocio y preparar una ficha de costos con calma, sin conexión. La Resolución 148/2023 del Ministerio de Finanzas y Precios establece un modelo para la evaluación de precios y tarifas; esta herramienta le ayuda a reunir la información, pero no sustituye la revisión de la norma ni el criterio de su entidad.", "imagen": "assets/help/01_bienvenida.png", "accion": {"tipo": "siguiente"}},
      {"id": "configurar_entidad", "titulo": "Identifique su negocio", "cuerpo": "Si desea, escriba el nombre de su Mipyme o negocio, su NIT y la actividad económica tal como aparecen en sus documentos. Puede saltar este paso y completarlo después desde Ajustes. El NIT se guarda únicamente en la base cifrada de este dispositivo.", "imagen": "assets/help/02_entidad.png", "accion": {"tipo": "siguiente"}, "opcional": true},
      {"id": "catalogos_iniciales", "titulo": "Prepare sus catálogos", "cuerpo": "Los catálogos guardan insumos y tarifas de trabajo para reutilizarlos en varias fichas. Puede cargar ejemplos de un paladar o una cafetería, editarlos con sus precios reales en CUP o MLC y eliminar lo que no necesite.", "imagen": "assets/help/03_catalogos.png", "accion": {"tipo": "ir_a_pantalla", "target": "catalogo_insumos"}, "opcional": true},
      {"id": "primera_ficha", "titulo": "Haga una ficha de práctica", "cuerpo": "Vamos a crear una ficha sencilla que usted podrá modificar. Los valores son demostrativos: sustitúyalos por datos respaldados por su carta tecnológica, comprobantes y registros; no son precios oficiales ni una fórmula normativa.", "imagen": "assets/help/04_primera_ficha.png", "accion": {"tipo": "ir_a_pantalla", "target": "editor_ficha_nueva"}, "opcional": true},
      {"id": "tour_interfaz", "titulo": "Ya conoce lo esencial", "cuerpo": "En la pantalla principal encontrará sus fichas, el botón para crear una nueva, el acceso a catálogos y el signo de interrogación para consultar ayuda. Puede volver a ver este recorrido cuando quiera desde Ayuda.", "imagen": "assets/help/05_tour.png", "accion": {"tipo": "ninguna"}}
    ]
  },
  "tooltips": {
    "campo_entidad_nombre": {"titulo": "Nombre de la entidad", "cuerpo": "Escriba el nombre legal de su Mipyme, cooperativa o negocio tal como aparece en sus documentos de constitución o registro. Si aún no lo tiene a mano, puede dejarlo para después.", "normativa": "Resolución 148/2023 del MFP, Anexo I: identificación de la entidad. Verifique el modelo oficial vigente."},
    "campo_entidad_nit": {"titulo": "NIT", "cuerpo": "Introduzca el Número de Identificación Tributaria de la entidad, sin cambiar ni completar dígitos por su cuenta. Se guarda en la base cifrada de este dispositivo; no lo incluya en capturas que vaya a compartir.", "normativa": "Dato de identificación de la entidad. TODO: confirmar referencia normativa exacta aplicable al NIT."},
    "campo_entidad_actividad": {"titulo": "Actividad económica", "cuerpo": "Describa la actividad que realiza el negocio y que corresponde a su autorización. Por ejemplo: elaboración y venta de alimentos. Use el texto de sus documentos cuando sea posible.", "normativa": "Resolución 148/2023 del MFP, Anexo I: identificación de la actividad. Verifique el modelo oficial vigente."},
    "campo_nombre_ficha": {"titulo": "Producto o servicio", "cuerpo": "Ponga un nombre que le permita reconocer qué se calcula, por ejemplo, 'Ración de congrí, 1 plato' o 'Servicio de reparación'. Evite nombres generales como 'Varios'.", "normativa": "Resolución 148/2023 del MFP, Anexo I: identificación del producto o servicio."},
    "campo_fila_1": {"titulo": "Fila 1 · Materias primas y materiales", "cuerpo": "Anote lo que se consume directamente para elaborar el producto o prestar el servicio: alimentos, envases u otros materiales. Use cantidades y precios de su carta tecnológica y comprobantes; no copie los ejemplos sin verificarlos.", "normativa": "Resolución 148/2023 del MFP, Anexo I, fila 1. Confirme el alcance en el texto oficial vigente."},
    "campo_fila_2": {"titulo": "Fila 2 · Combustibles", "cuerpo": "Registre el combustible que corresponda al proceso productivo, con la cantidad realmente utilizada y su costo documentado. No duplique un gasto que ya anotó en otra fila.", "normativa": "Resolución 148/2023 del MFP, Anexo I, fila 2. TODO: confirmar el detalle de inclusión aplicable."},
    "campo_fila_3": {"titulo": "Fila 3 · Energía", "cuerpo": "Incluya el gasto de energía atribuible a la producción cuando pueda determinarlo con una base razonable y comprobable. Si no sabe cómo distribuir una factura compartida, consulte a la persona responsable de contabilidad; no invente un porcentaje.", "normativa": "Resolución 148/2023 del MFP, Anexo I, fila 3. TODO: confirmar método de distribución aplicable."},
    "campo_fila_4": {"titulo": "Fila 4 · Fuerza de trabajo", "cuerpo": "Anote los gastos de trabajo directamente vinculados al producto o servicio según los datos laborales y de pago de su negocio. Use una tarifa y unidad coherentes; no confunda salario con precio de venta.", "normativa": "Resolución 148/2023 del MFP, Anexo I, fila 4. Verifique los conceptos admitidos con la regulación laboral y contable vigente."},
    "campo_fila_5": {"titulo": "Fila 5 · Gastos indirectos de producción", "cuerpo": "Aquí pueden corresponder gastos necesarios para producir que no se asignan directamente a una unidad, como determinados gastos de equipos o mantenimiento. La plantilla muestra desgloses pendientes: no los complete suponiendo importes ni use una base sin justificar.", "normativa": "Resolución 148/2023 del MFP, Anexo I, fila 5. TODO: validar el desglose y método de distribución oficial."},
    "campo_fila_6": {"titulo": "Fila 6 · Gastos generales y de administración", "cuerpo": "Consigne solo los gastos administrativos que correspondan al modelo y período. Si un gasto sirve para varios productos, documente cómo distribuyó su parte; no lo cuente dos veces.", "normativa": "Resolución 148/2023 del MFP, Anexo I, fila 6. TODO: confirmar método de distribución aplicable."},
    "campo_fila_7": {"titulo": "Fila 7 · Gastos de distribución y ventas", "cuerpo": "Incluya los gastos que correspondan a llevar el producto al cliente o realizar la venta, siempre que el modelo y las reglas vigentes los admitan. Sepárelos de los costos de producción.", "normativa": "Resolución 148/2023 del MFP, Anexo I, fila 7. Verifique alcance y tratamiento en el texto oficial."},
    "campo_fila_8": {"titulo": "Fila 8 · Gastos bancarios", "cuerpo": "Anote los gastos bancarios asociados que correspondan, respaldados por estados o comprobantes. No registre aquí el importe de una venta ni una comisión que ya esté incluida en otra partida.", "normativa": "Resolución 148/2023 del MFP, Anexo I, fila 8. TODO: confirmar conceptos aplicables."},
    "campo_fila_9": {"titulo": "Fila 9 · Costo total de producción", "cuerpo": "Es un subtotal calculado a partir de las filas anteriores cuando están completas y confirmadas. Si falta información, FichaCosto muestra 'Pendiente' en vez de tratar lo desconocido como cero.", "normativa": "Resolución 148/2023 del MFP, Anexo I, fila 9. Verifique la operación en el modelo oficial."},
    "campo_fila_10": {"titulo": "Fila 10 · Margen de utilidad", "cuerpo": "No es un porcentaje que la aplicación deba inventar. Registre únicamente el importe y la base que su entidad tenga autorizados y documentados; el cálculo que muestra la aplicación es una estimación configurable, no una regla normativa.", "normativa": "Resolución 148/2023 del MFP, Anexo I, fila 10. TODO: confirmar base y límites aplicables para su actividad."},
    "campo_fila_11": {"titulo": "Fila 11 · Precio o tarifa total", "cuerpo": "La plantilla puede mostrar un total cuando los datos requeridos están completos. Revíselo contra el método y las autorizaciones vigentes antes de usarlo para fijar o presentar un precio.", "normativa": "Resolución 148/2023 del MFP, Anexo I, fila 11. Verifique el resultado con el modelo oficial vigente."},
    "selector_moneda": {"titulo": "Moneda · CUP o MLC", "cuerpo": "Seleccione la moneda del importe que realmente pagó o registró. CUP y MLC se suman por separado: FichaCosto no los convierte ni supone una tasa de cambio. Si un insumo se pagó en MLC, consérvelo en MLC y revise cómo debe presentarlo su entidad.", "normativa": "Use los comprobantes y reglas contables vigentes; la aplicación no determina tasas de cambio oficiales."},
    "margen_utilidad": {"titulo": "Margen de utilidad", "cuerpo": "Déjelo vacío si todavía no tiene una base e importe autorizados. El porcentaje o factor configurado solo sirve para una estimación; no constituye una autorización ni una fórmula oficial de la Resolución 148/2023.", "normativa": "Resolución 148/2023 del MFP, Anexo I, fila 10. TODO: confirmar base autorizada y límites para cada actividad."},
    "licencia_fingerprint": {"titulo": "Huella de este dispositivo", "cuerpo": "La huella identifica esta instalación para comprobar una licencia offline. Cópiela desde el botón correspondiente y envíela al proveedor autorizado; no equivale a la huella de otro teléfono u ordenador. No revela por sí sola sus fichas.", "normativa": "La licencia se vincula al dispositivo según la política de licenciamiento de FichaCosto."},
    "licencia_tipo": {"titulo": "Tipo y funciones de la licencia", "cuerpo": "La licencia indica las funciones y el período autorizados para este dispositivo. Para importar, seleccione el archivo .lic recibido del emisor; no escriba ni modifique su contenido. Los datos existentes siguen accesibles aunque la licencia expire.", "normativa": "Consulte las condiciones de la licencia emitida para este dispositivo."},